{
  "hijri_year": 1448,
  "gregorian_year": 2026,
  "last_updated": "2026-10-16",
  "status": "partial",
  "country_code": "MA",
  "country_name_ar": "المغرب",
  "country_name_en": "Morocco",
  "currency": "MAD",
  "official_source_url": "https://www.habous.gov.ma/%D8%A7%D9%84%D9%85%D8%AC%D9%84%D8%B3-%D8%A7%D9%84%D8%B9%D9%84%D9%85%D9%8A-%D8%A7%D9%84%D8%A7%D8%B9%D9%84%D9%89/22172-%20-%D8%B1%D8%A3%D9%8A-%D8%A7%D9%84%D9%85%D8%AC%D9%84%D8%B3-%D8%A7%D9%84%D8%B9%D9%84%D9%85%D9%8A-%D8%A7%D9%84%D8%A3%D8%B9%D9%84%D9%89-%D9%81%D9%8A-%D8%B4%D8%A3%D9%86-%D8%B2%D9%83%D8%A7%D8%A9-%D8%A7%D9%84%D9%81%D8%B7%D8%B1-%D9%88%D9%85%D9%82%D8%AF%D8%A7%D8%B1%D9%87%D8%A7-%D9%83%D9%8A%D9%84%D8%A7%D9%8B-%D9%88%D9%86%D9%82%D8%AF%D8%A7%D9%8B-%D9%84%D8%B9%D8%A7%D9%85-1447%D9%87%D9%80-2026%D9%85.html",
  "zakat_al_fitr": {
    "value_per_person": 25.0,
    "notes_ar": "25 درهماً مغربياً عن كل نفس وفق رأي المجلس العلمي الأعلى لسنة 1447هـ/2026م. الأصل صاع نبوي (~2.5 كغ من الحبوب أو الدقيق)، ويجوز إخراجها نقداً قبل العيد بيومين إلى ثلاثة.",
    "notes_en": "25 MAD per person per the Higher Scientific Council for 1447 AH / 2026 CE. Food equivalent ~2.5 kg of grains/flour; cash allowed; may be paid 2–3 days before Eid."
  },
  "zakat_categories": {
    "zakat_al_mal": {
      "category_ar": "الأموال النقدية والذهب والفضة وعروض التجارة",
      "category_en": "Cash, Gold, Silver, and Commercial Goods",
      "nisab_cash": null,
      "nisab_gold_grams": 85,
      "nisab_silver_grams": 595,
      "percentage_rate": 2.5,
      "conditions_ar": [
        "بلوغ النصاب المعتمد",
        "دوران الحول القمري الكامل",
        "الملكية التامة والخلو من الدين"
      ],
      "conditions_en": [
        "Reaching the approved Nisab",
        "Possession for one full lunar year",
        "Full ownership and debt-free status"
      ]
    },
    "agriculture": {
      "category_ar": "الزروع والثمار (الحبوب والتمور والزيتون)",
      "category_en": "Crops and Fruits (Grains, Dates, and Olives)",
      "nisab_value": 5,
      "nisab_unit": "awsuq",
      "nisab_kg_approx": 750.0,
      "nisab_ar": "5 أوسق (ما يعادل حوالي 750 كغ تقريباً)",
      "nisab_en": "5 Awsuq (equivalent to approx. 750 kg)",
      "rates": [
        {
          "type_ar": "مسقي بماء المطر دون كلفة (بعلي)",
          "type_en": "Rain-fed / Naturally irrigated",
          "rate_percentage": 10.0
        },
        {
          "type_ar": "مسقي بآلات وكلفة اصطناعية (سقوي)",
          "type_en": "Artificially irrigated with cost",
          "rate_percentage": 5.0
        }
      ],
      "conditions_ar": [
        "بلوغ النصاب وقت الحصاد والاشتداد ولا يشترط فيها الحول"
      ],
      "conditions_en": [
        "Reaching Nisab at the time of harvest; the lunar-year condition does not apply"
      ]
    },
    "livestock": {
      "category_ar": "الأنعام والمواشي",
      "category_en": "Livestock (An'am)",
      "sub_categories": [
        {
          "type_ar": "الإبل (الجمال)",
          "type_en": "Camels",
          "nisab_value": 5,
          "nisab_unit": "heads",
          "nisab_ar": "5 إبل",
          "nisab_en": "5 camels",
          "rate_ar": "في كل 5 إبل شاة، وتتغير الفريضة بعد ذلك حسب الجداول الشرعية التفصيلية",
          "rate_en": "1 sheep for every 5 camels; rules scale according to detailed Sharia tables"
        },
        {
          "type_ar": "البقر",
          "type_en": "Cows/Cattle",
          "nisab_value": 30,
          "nisab_unit": "heads",
          "nisab_ar": "30 بقرة",
          "nisab_en": "30 cows",
          "rate_ar": "في كل 30 بقرة تبيع أو تبيعة، وفي كل 40 مسنة",
          "rate_en": "For every 30 cows: 1 Tabi'; for every 40: 1 Musinnah"
        },
        {
          "type_ar": "الغنم والماعز",
          "type_en": "Sheep and Goats",
          "nisab_value": 40,
          "nisab_unit": "heads",
          "nisab_ar": "40 شاة",
          "nisab_en": "40 sheep/goats",
          "rate_ar": "من 40 إلى 120: شاة. من 121 إلى 200: شاتان. من 201 إلى 300: ثلاث. ثم شاة لكل 100",
          "rate_en": "40–120: 1 sheep. 121–200: 2. 201–300: 3. Then 1 sheep per additional 100"
        }
      ],
      "conditions_ar": [
        "أن تكون سائمة (ترعى الكلأ المباح معظم العام) وفق جمهور الفقهاء، مع دوران الحول"
      ],
      "conditions_en": [
        "Freely grazing (Saimah) for most of the year per the majority of scholars, plus one lunar year"
      ]
    },
    "treasures_and_minerals": {
      "category_ar": "الركاز والمعادن (ما يستخرج من باطن الأرض)",
      "category_en": "Rikaz and Minerals (Buried Treasures)",
      "sub_categories": [
        {
          "type_ar": "الركاز (دفن الجاهلية)",
          "type_en": "Rikaz (Ancient buried treasure)",
          "nisab_value": null,
          "nisab_ar": "لا يشترط له نصاب ولا حول",
          "nisab_en": "No Nisab or lunar year required",
          "rate_percentage": 20.0,
          "rate_ar": "الخمس (20%) يخرج فور العثور عليه",
          "rate_en": "One-fifth (20%) paid immediately upon extraction"
        },
        {
          "type_ar": "المعادن والنفط والغاز",
          "type_en": "Minerals, Oil, and Gas",
          "nisab_value": 85,
          "nisab_unit": "gold_grams",
          "nisab_ar": "ما يعادل نصاب الذهب (85 غراماً)",
          "nisab_en": "Equivalent to Gold Nisab (85 grams)",
          "rate_percentage": 2.5,
          "rate_ar": "ربع العشر (2.5%) يخرج فور الاستخراج بعد خصم تكاليف الإنتاج",
          "rate_en": "2.5% paid after deducting production costs"
        }
      ]
    }
  },
  "asnaf_al_zakat": {
    "ar": [
      "الفقراء",
      "المساكين",
      "العاملون عليها",
      "المؤلفة قلوبهم",
      "في الرقاب",
      "الغارمون",
      "في سبيل الله",
      "ابن السبيل"
    ],
    "en": [
      "Al-Fuqara",
      "Al-Masakin",
      "Al-Amilina Alayha",
      "Al-Mu'allafati Qulubuhum",
      "Fi al-Riqab",
      "Al-Gharimin",
      "Fi Sabilillah",
      "Ibn al-Sabil"
    ]
  }
}
